{
  "capabilities": [
    {
      "id": "veyra.cap.solid_surface/1",
      "params": {
        "figure_ref": "figure"
      }
    }
  ],
  "classification": {
    "tags": []
  },
  "codec": "zstd+shuffle2",
  "domains": [
    {
      "frame": "body_fixed",
      "id": "surface",
      "max_level": 5,
      "tile_log2": 3,
      "topology": "veyra.topo.dir_cube/1",
      "vertical": {
        "kind": "none"
      }
    }
  ],
  "dynamics": {
    "descriptor": {
      "hash": "b3:6d4f51c059b4b1c6d773772e4df06376b88c658de836fdb48a4d71799d090970",
      "path": "dynamics/descriptor.json"
    },
    "origin_keyframe": {
      "hash": "b3:fc1bdd45418ef243d05ba74121f44aa207eef579ade34df14cbbaf6fc41276a9",
      "path": "dynamics/origin.json"
    }
  },
  "figure": {
    "kind": "sphere",
    "radius_m": "1"
  },
  "format_version": {
    "major": 1,
    "minor": 0
  },
  "frames": {
    "body_fixed": {
      "axes": "+Z is the positive rotation pole; +X is the prime meridian; right-handed"
    }
  },
  "identity": {
    "object_id": "obj:a85b2cd1bf3aa8f8002083d45496ac7c",
    "origin": {
      "kind": "fixture",
      "name": "cb6-unknown-critical-field"
    }
  },
  "indexes": {},
  "physical": {
    "gm_m3_s2": "1",
    "gravity_model": "point_mass"
  },
  "reference_surfaces": [],
  "required_features": [
    "veyra.body/1",
    "veyra.canon.jcs/1",
    "veyra.codec.zstd-shuffle2/1",
    "veyra.topo.dir_cube/1"
  ],
  "schema": "veyra.body/1",
  "sections": {
    "registry": {
      "hash": "b3:98ebfbfc8b0dc8d85163ebb2aa6b6c078a44f5ae450afe92bcedcc1b197cd268",
      "path": "registry/fields.json"
    }
  }
}